Country;nuitee;delais_comm;traveler_infos;review_title;negative_review;positive_review;grade_review;room_type;mois_sejour;mois_num;annee_sejour;date
Ukraine;2;0;Famille;Good choice for visiting Disneyland;;;10.0;Chambre Supérieure - Côté Lac;Septembre;9;2022;2022-09-01
France;1;0;Famille;Agréable;la qualité de la chambre n’était pas top, vieux équipements, rapport qualité prix n’est pas correct;la proximité du parc Disneyland Paris;6.0;Chambre Supérieure;Novembre;11;2022;2022-11-01
Belgique;1;0;Famille;déçue qualité prix;la propreté;l emplacement;6.0;Chambre Supérieure;Novembre;11;2022;2022-11-01
France;1;0;Famille;très moyen par rapport au prix;hôtel très vieillissant et pas de shampoing gel douche;très bon personnel dédié mais la sécurité fait du zèle;6.0;Chambre Supérieure;Novembre;11;2022;2022-11-01
France;1;0;Famille;Très bien;"La porte ne marchait pas bien.
Quand on met le badge. Il ne s ouvre pas du premier coup. On a du ré essayer pleins de fois.
La télé avait beaucoup d option en plus des chaînes normaux. Mais il fallait attendre longtemps pour passer d'un onglet a un autre.";"La décoration de la chambre est adorable.
On a une bouilloire pour préparer du thé ou du café.
On a un large choix au petit déjeuné.
La piscine est top. Pas beaucoup de monde.
La boutique dans l hôtel est super pratique.";8.0;Chambre Supérieure;Novembre;11;2022;2022-11-01
France;1;1;Voyageur individuel;Comme une ambiance de croisière Disney;Peut être le fait qu'on ne m'ait pas offert de badge en rapport avec la saison d'halloween :/ Mais sincèrement c'est vraiment pour trouver quelque chose !!;L'ambiance nautique de l'hôtel et la qualité des infrastructures rendent cette hôtel disney très agréable. Tout est mis en place pour que l'on se sentent bien après une belle journée au parc. Piscine & salle de sport ( serviettes fournis à discrétion ) , restaurant, bar et même une boutique Disney dans l'hôtel. Dans la chambre, machine à café senseo, thé et eau minéral.;8.0;Chambre Supérieure;Octobre;10;2022;2022-10-01
Suisse;2;0;Famille;très bon moment passé en famille;;je pense qu’il serait judicieux afin que l’on fasse un effort collectif concernant nos énergie d’éteindre les lumières à partir de minuit concernant la piscine extérieure et les guirlandes lumineuses;7.0;Chambre Supérieure;Octobre;10;2022;2022-10-01
Suisse;2;0;Famille;agreable, très couteux;"vieux (join, accessoires) et cher 
repas beaucoup trop cher pr les enfants";le personnel;7.0;Chambre Supérieure;Octobre;10;2022;2022-10-01
Belgique;1;1;Famille;Avis mitigé;"Lors de l'accueil, nous avons été accueilli par un monsieur très gentil, par contre une dame est venu l'interrompre plusieurs fois parce qu'elle avait fini sa journée et qu'il devait faire quelque chose avec elle... elle n'était pas souriante et a bien fait comprendre que nous étions dérangeant.
Nous avions demandé un lit bébé dans la chambre, il y en avait un mais c'est un lit de voyage sans matelas supplémentaire, un lit vraiment pas confortable. Et dans la seconde chambre il y avait un lit très confortable et l'autre pas du tout, matelas très usé. 
Dans une des chambres il y avait des mies de pain sur le sol et des mouchoirs par terre. 
Il manque un frigo dans les chambres car par exemple nous avions du lait pour notre enfant à conserver au frais après ouverture... nous avons pu le jeter alors que le matin notre enfant devait boire du lait.
Je trouve dommage d'avoir des détails comme ceux là négatif alors que c'est actuellement le 2 ème meilleur hôtel de ma chaîne Disneyland Paris";"L'hôtel est très joli, le décor est détaillé. 
Le lit double est confortable.
Le monsieur qui nous a accueillit à l'accueil était très sympa. Le petit déjeuner était très copieux, il y a beaucoup de choix différents pour les viennoiseries et les pains, chaque région peut se faire le petit-déjeuner qu'il aime.";7.0;Chambre Supérieure;Septembre;9;2022;2022-09-01
France;1;1;Famille;cher pour les prestations fournis;pas conforme à ma réservation et pas à la hauteur d un 4 étoiles;pas loin du parc Disney;6.0;Chambre Supérieure - Côté Lac;Septembre;9;2022;2022-09-01
France;1;0;Famille;Cher et bof !;;C'était l'usine ! L'hôtel etait noir de monde, la queue à la réception, des groupes bruyants, des couloirs interminables, signalisation insuffisante des ascenseurs, manque de souplesse du personnel appliquant des procédures rigides ...;6.0;Chambre Supérieure;Septembre;9;2022;2022-09-01
Belgique;1;0;Famille;déçu de bcp de chose;"chambre déplorable, matelas TRÈS USÉS ( très mal au dos au réveil) sanitaire à refaire complètement 
propreté correcte mais peux mieux faire au vu du prix de la nuitée 530€ sans petit déjeuner pour 4";personnel super gentil bien placer par rapport au parc Disney;6.0;Chambre Supérieure;Septembre;9;2022;2022-09-01
Belgique;1;0;Famille;Très bien;manque d’équipements pour le prix . pas de frigo ds la chambre une cafetière sans café . là contrôleur de la Clim qui ne marche pas très bien;la situation et les décors le confort;8.0;Chambre Supérieure;Septembre;9;2022;2022-09-01
France;2;0;Voyageur individuel;Avis mitigé;La chambre : absolument pas la hauteur du prix. Absence de produits de toilettes, de nécessaire à cafe-the-tisane. Les chaînes Disney de la TV étaient indisponibles. Linge de toilette vieillissant. Besoin général d'un rafraichissement. Ne correspond pas à une chambre d'hôtel 4****;Hôtel : magnifique. Très belle décoration. Parties communes et restaurants très agréables;7.0;Chambre Supérieure - Côté Lac;Août;8;2022;2022-08-01
Belgique;2;1;Famille;Agréable;;La chambre et le déjeuner;7.0;Chambre Supérieure;Juillet;7;2022;2022-07-01
Belgique;1;0;Famille;Prix élevé mais totalement justifié;Pas de frigo dans la chambre dommage.;Déjeuner de qualité, service rapide, personnel sympa et disponible.;7.0;Chambre Supérieure;Août;8;2022;2022-08-01
France;1;0;Famille;excellent;rien;la déco, la piscine;8.0;Chambre Supérieure - Côté Lac;Août;8;2022;2022-08-01
France;1;1;Famille;agréable mais manque d animation;pas de personnages Disney;le décor la propreté;8.0;Chambre Supérieure - Côté Lac;Juin;6;2022;2022-06-01
France;2;0;Famille;très cher sans raison;états du mobiliers dans les chambres , le service;pas grand chose, c’est vétuste , les salles de bains sont pitoyables ,le mobilier est dans un état pitoyable . bref pour le prix peu mieux faire …;6.0;Chambre Supérieure;Juillet;7;2022;2022-07-01
France;1;0;Famille;Bien mais trop cher;Le petit déjeuner est vraiment hors de prix;La localisation;7.0;Chambre Supérieure;Juillet;7;2022;2022-07-01
France;2;0;Famille;Très bien;Les Lits devraient être plus large;Belle hôtel bon emplacement;8.0;Chambre Supérieure - Côté Lac;Juin;6;2022;2022-06-01
France;1;0;Famille;je ne passerais plus par booking pour mes vacances;nous avons louer une chambre supérieur avec terrasse je cherche toujours la terrasse … ne louer pas de chambre avec terrasse quand celle ci est inexistante;Disneyland;7.0;Chambre Supérieure avec Terrasse;Juin;6;2022;2022-06-01
La Réunion;1;0;Famille;Super malgré quelques points à améliorer;Plateau de courtoisie des anciens occupants non débarrassé, pas de dosette pour la cafetière, salle de bain vieillissante (distributeur de savon et porte serviettes cassés);Le personnel est extrêmement agréable, tout est fait pour que nous ayons un accueil chaleureux;8.0;Chambre Supérieure;Juin;6;2022;2022-06-01
Suisse;4;1;Famille;Agréable;"Le lit bébé pour notre fille de 2ans ! 
Cet hôtel doit accueillir une multitude d'enfants et pourtant le lit se résumait à un voeux lit parapluie avec un drap blanc trop grand. 
Pas de drap Disney sympa, pas de petit kit d'arrivée, de petit savon ou produit de soin pour les enfants. C'est limite pour un 4*.
Le service minimum dans la chambre. 
Il fallait toujours réclamer pour avoir du papier toilette, de l'eau ou même des cotons-tiges. Tout est disponible gratuitement mais rien n'est mis dans la chambre.";La proximité avec le parc, les grandes piscines intérieures et extérieures assez chauffée pour les enfants, la gentillesse du personnel du bar.;6.0;Chambre Supérieure - Côté Lac;Mai;5;2022;2022-05-01
France;1;0;Famille;Très bien;Pour le prix déçue de ne pas voir les personnages dans l’hôtel. la TV ne fonctionnait pas le 1er jour et pas de capsule à café à côté de la machine à café.;le décor, le personnel et la proximité avec le parc;8.0;Chambre Supérieure - Côté Lac;Juin;6;2022;2022-06-01
France;1;1;Famille;Super !;"Pas de café/thé à disposition dans les chambres 
Manque de serviettes et de prises électriques";"Chambre très spacieuse, propre
Superbe vue sur le lac";8.0;Chambre Supérieure - Côté Lac;Mai;5;2022;2022-05-01
Suisse;2;0;Famille;Nous avons passé un très bon séjour dans l’ensemble!;"rien de trop significatif à signaler ;
• rapport qualité-prix on ne reviendra pas dessus c’est Disney c’est ainsi et on est post-covid soit
• mal reçu au desk Concierge pour une demande, pas gravissime, je m’attendais pas à des miracles clé d’or , je voulais juste me renseigner s’il y avait une chance de déplacer une réservation buffet soir de 45 minutes en anticipant , la réponse du monsieur:
« c’est ça ou McDo estimez vous heureux de pouvoir dîner avec vos enfants » j’aurais préféré un « désolé rien n’est possible pour ce soir » pour un 4* à ce tarif…";"• le buffet Cape-Cod, petit-déjeuner et dîner est de bonne qualité, heureusement au prix, certes, mais même les plats de poissons et fruits de mer sont savoureux , rare dans une telle industrie!
• les cast members (employés) se donnent énormément de peine pour être avenants et sympathiques (même sur une journée rouge et noire en fréquentation) 
• les chambres sont confortables et fonctionnelles 
• les flux et infrastructures sont bien pensés";8.0;Chambre Supérieure avec Terrasse;Mai;5;2022;2022-05-01
France;1;0;Famille;Un très bel hôtel, un très beau séjour malgré quelques petits problèmes au démarrage.;"Nous n'avons pas eu de chambres adjacentes alors que nous l'avons demandé. Après l'enregistrement, le personnel nous a indiqué qu'un sms nous serait envoyé pour nous prévenir que les chambres étaient prêtes, mais nous ne l'avons jamais reçu. Il y a enfin eu un problème au moment de l'enregistrement des cartes pour accéder aux chambres ; nous nous sommes rendus compte qu'elles n'étaient pas activées, devant la porte de la chambre [...]. Dommage. Malgré ces désagréments dont on pourrait ce passer compte tenu du prix de l'hôtel, le séjour s'est très bien passé.";L'hôtel, sa situation, sa décoration, les équipements qu'il propose correspondent véritablement à nos attentes lors de la réservation. Cela a été une parenthèse magique, enchantée pour notre famille.;8.0;Chambre Supérieure;Mai;5;2022;2022-05-01
France;2;0;Famille;Bien ;;la qualité de la restauration;7.0;Chambre Supérieure - Côté Lac;Mai;5;2022;2022-05-01
France;1;0;Famille;Agréable;"La chambre : 
Lit 140 matela qui a vecu
Robineterie non vice qui tourne sur elle meme
Chambre besoin d un coup de jeune
Pour 350 euro la nuit ......";Disney accueil parfait;6.0;Chambre Supérieure;Mai;5;2022;2022-05-01
France;1;1;Famille;ULTRA CHER !!!!!!!!!!!!!!!!!!!!!!!!!!!!!!!!!!!!!!!;;Nous allons à l'hotel à coté du Parc Disney donc avec des enfants. Le menu Enfant 30€ et le petit déjeuné 23€ pour un enfant de 4 ans est tout simplement aberrant!!!!!!!!!!! et même pour un enfant de 9 ans.;7.0;Chambre Supérieure;Avril;4;2022;2022-04-01
France;1;1;Famille;.SOS doudous laisse un goût amer...;Nous avons oublié les doudous dans la chambre. Nous avons appelé l'hôtel immédiatement après l'avoir quitté pour les prévenir mais rien a été fait... Il est désolant que dans un hôtel à ce prix, qui reçoit des milliers d'enfants chaque jour, dans un parc qui émerveille les enfants, aucun service doudous perdus soit mis en place et que les doudous ne soient pas mieux considérés que cela...;La chambre est spacieuse et bien équipée. L'hôtel est grandiose est super bien place à côté du parc;7.0;Chambre Supérieure;Mars;3;2022;2022-03-01
France;1;0;Famille;Site de l'hôtel idéal, qualité équipements et chambres moyenne;Chambre familiale exiguë. Salle de bains vétuste. Rapport qualité- prix pas adapté du tout.;Le personnel a l'écoute . La propreté et le calme.;6.0;Chambre Supérieure;Avril;4;2022;2022-04-01
France;1;1;Famille;Très bon séjour, dommage que le beau temps n'y était pas.;La déco faisait vieillotte, télé que nous l'avions connue il y a quelques années.;Super petit déjeuner et le personnel trop gentil ! Par contre notre chambre était un peu vieillotte, je m'attendais à mieux.;8.0;Chambre Supérieure;Mars;3;2022;2022-03-01
France;1;1;Famille;Très bel hôtel, bien situé à l'entrée du parc. Mais absolument pas confortable, literie : une cata;"Literie absolument pas au niveau pour le prix demandé... le matelas : une vraie planche, on se réveille avec un mal de dos pas possible. Les oreillers mous.. salle de bain vieillotte.
Pour le prix payé ce n'est absolument pas normal de dormir aussi mal...";"La situation de l'hôtel est top, juste à côté du parc. On est directement plongés dans l'ambiance Disney.. 
Le restaurant est excellent, heureusement car très très cher...";6.0;Chambre Supérieure;Mars;3;2022;2022-03-01
France;4;1;Famille;Très correct prix en rapport avec les prestations;Un p’tit coin repas plus pratique;Cadre situation Pdj en chambre;8.0;Chambre Supérieure - Côté Lac;Mars;3;2022;2022-03-01
France;1;1;Famille;Bien ;L'impossibilité pour mon fils de prendre une photo avec le personnage car il était trop tard .....;L emplacement par rapport au parc;7.0;Chambre Supérieure;Mars;3;2022;2022-03-01
Israël;2;0;Famille;Très bien;"La chambre est trop loin de l ascenseur. 323 pas pour y accéder 
Il n y a pas de café et de restaurant a part le petit dejeuner.
L acclim ne marche pas trop bien.";"La cjambre etait grande. Le personnel tres accueillant. La chambre propre.
Le lac magnifique et la proximité a disney extra.";8.0;Chambre Supérieure;Avril;4;2022;2022-04-01
France;1;0;Famille;Très bien;"Je pense qu’il mette au second plan les réservations Booking.com 
Heureusement après un appel à la réception on nous a changer de chambre";"Le décor 
La réaction pour nous changer de chambre (10min)";8.0;Chambre Supérieure;Avril;4;2022;2022-04-01
Belgique;2;0;Voyageur individuel;Bien ;le fait qu’on débarrasse la table du déjeuner alors que je n’avais pas fini, 28€ pour un buffet à volonté et qu’on débarrasse la table ça fait cher payé.;le confort, l’amabilité, le fait qu’on puisse voir des personnages de Disney;7.0;Chambre Supérieure;Avril;4;2022;2022-04-01
France;1;0;Groupe;passable;nous devions avoir une baignoire et deux lits doubles. Et nous avons eu un lit double et un lit superposé ainsi qu’une douche… quelle déception;la propreté des lieux;7.0;Chambre Supérieure;Avril;4;2022;2022-04-01
France;2;0;Famille;Très bien;Le prix du buffet;La chambre, la rencontré avec Mickey;8.0;Chambre Supérieure;Avril;4;2022;2022-04-01
France;1;1;Famille;Très bien;;la douche c une catastrophe;8.0;Chambre Supérieure;Mars;3;2022;2022-03-01
France;1;0;Famille;Très bon séjour, à renouveler;Un seul peignoir pour 2 personnes, l'absence de gel douche dans la salle de bain;La situation, le compass club car on est chouchoute;8.0;Chambre Club Compass (2 Adultes);Mars;3;2022;2022-03-01
France;1;0;Groupe;tres bon séjour;chambre très loin de l’entrée, j’ai du traverser des couloirs infinis pour y accéder avec ma fibromyalgie c’est très compliqué de marcher autant avec les douleurs chroniques;La proximité du parc, le décor et thème de l’hôtel. personnel agréable;6.0;Chambre Supérieure;Mars;3;2022;2022-03-01
France;1;0;Famille;Hotel classe personnel souriant chambre agréable et lit confortable;"La machine à café complètement à l opposé de la chambre 
La lumière et le bruit à côté du sauna hamam";"Tout proche du parc Disney
Bel hôtel bien classe";8.0;Chambre Supérieure;Mars;3;2022;2022-03-01
Belgique;1;0;Famille;sympa;"- longue attente au check in le soir 
- lit double 1m40
- le prix du petit déjeuner 
- la chambre tout au bout de l’hôtel 
- pas de brosse pour les toilettes";le côté féerique les détails de disney;7.0;Chambre Supérieure;Mars;3;2022;2022-03-01
France;1;0;Famille;Magnifique;Certains défauts dans la salle de bain;Les réceptionnistes étaient top et tout les autres personnels de l’hôtel était top. :-);8.0;Chambre Supérieure;Mars;3;2022;2022-03-01
France;1;0;Famille;Très bon séjour détente en famille;"Pourquoi nous punir en nous installant dans la chambre la plus loin de la réception ? ( 3394 au fond du couloir aile Est )
Je n'ai jamais vu un couloir aussi long ! ( je pense qu'il y a record )
Est-ce parce que nous avons réservé avec Booking ?";"La proximité de l'hôtel par rapport au Parc grace à la navette gratuite.
Le restaurant de qualité mais des prix 4* : 38€ le buffet du soir sans les boissons, 28 le petit déjeuner.";8.0;Chambre Supérieure;Mars;3;2022;2022-03-01
France;1;0;Couple;Parfait.;;Propreté et proximité des parcs;8.0;Chambre Supérieure;Mars;3;2022;2022-03-01
France;1;0;Groupe;Bien pour les enfants moins pour les adultes;La localisation de la chambre, lorsque j'ai fais la réservation j'avais demandé à ce que les chambres soient à côté mais à mon arrivée l'info n'avait pas été transmise par booking d'après Disney. Néanmoins les cast memebers ont réussi à mettre les chambres côte à côte mais à l'autre bout de l'hôtel ce qui est le point négatif de mon séjour, presque 5 minutes de marche.;Les petites attantions, le décor, le personnel. La prestation dans son ensemble était bien surtout pour les enfants qui étaient très contents.;7.0;Chambre Supérieure;Mars;3;2022;2022-03-01
Belgique;1;0;Couple;Un peu déçu;;J ai connu l hôtel à ses débuts, la deco etait plus chic;7.0;Chambre Supérieure;Mars;3;2022;2022-03-01
France;1;0;Famille;Agréable;"la chambre pas insonorisée il n’y a pas l’équipement de la description type bouilloire la propreté n’était pas à 100% poussière dans la chambre poils au niveau sanitaire 
et pour une chambre supérieur je ne vois absolument pas le plus d’une chambre standard";il n’y a rien à dire sur le personnel très souriant et accueillant au top;6.0;Chambre Supérieure;Mars;3;2022;2022-03-01
France;1;0;Famille;Très bon hôtel pour un séjour à Disneyland;"La réception à l'étage quand nous arrivons du parc donc nous devons chercher lorsque nous ne connaissons pas l'hôtel
Peu de pression dans la douche
Le matelas un peu trop dur";"La proximité des parcs
La propreté de l'hôtel
La prise en charge rapide à l'arrivée
Très bon accueil pour les petits déjeuners";8.0;Chambre Supérieure;Mars;3;2022;2022-03-01
France;1;0;Groupe;Bien ;douche. Eau trop chaude ou trop froide, pas possible de régler;"proximité du parc 
literie confortable";7.0;Chambre Supérieure;Mars;3;2022;2022-03-01
France;2;0;Famille;bon séjour mais revoir points négatifs, meubles vieillissants;le chauffage ne fonctionnait pas, la commode tiroirs défectueux,;l’ambiance, le personnel, les chambres spacieuses, le service;8.0;Chambre Supérieure - Côté Lac;Mars;3;2022;2022-03-01
France;1;0;Famille;excellent séjours;petit déjeuné très chère et moyen pas assez de choix;magnifique hotel superbe piscine bon accueil;8.0;Chambre Supérieure;Mars;3;2022;2022-03-01
France;1;0;Famille;séjour agréable;l immensité;l emplacement;7.0;Chambre Supérieure;Mars;3;2022;2022-03-01
La Réunion;1;0;Famille;bien;trop type aéroport, pas assez de personnalisation avec les clients, pas assez d’écoute à la conciergerie sachant qu’avant de venir le numéro est toujours injoignable;sa beauté qui fait rêver;7.0;Chambre Supérieure;Mars;3;2022;2022-03-01
Belgique;1;0;Famille;Embarquez pour une croisière avec Donald;Les lits sont petits pour deux adultes. Lit bebe = lit parapluie (prévoir un matelas de voyage en plus).;Le cadre, la gentillesse du personnel, le petit-déjeuner.;8.0;Chambre Supérieure;Mars;3;2022;2022-03-01
Allemagne;1;0;Famille;Très bien;Le rapport qualité prix;La situation avec ma proximité du village Disney, la vue sur le lac, le confort de la literie;8.0;Chambre Supérieure;Mars;3;2022;2022-03-01
France;1;0;Couple;Très bon séjour;"Les rideaux de la chambre ne sont pas du tout occultants. Il m’a été très difficile voir impossible de dormir sans le noir complet. J’ai déjà réservé un nouveau séjour en janvier et je conseille de prendre un masque de voyage pour les personnes comme moi.. je me suis endormie d’épuisement à 6h30. 
L’eau de la piscine comme tous les hôtels disney mériterait d’être plus chaude.
Je vous conseille de prendre votre petit déjeuner au New York, plus calme pour le même prix.";Le personnel est très adapté et réactif. L’hôtel est joli. Les prestations sont de qualité pour le prix que l’on paye. La vue lac est sublime, je recommande fortement cet hôtel.;8.0;Chambre Supérieure;Mars;3;2022;2022-03-01
France;1;0;Famille;Top, merci. l hôtel est très bien situé par rapport au parc. tout peut se faire à pieds;les chambres un peu vétustes;très bon séjour, tout était bien . Piscine top;8.0;Chambre Supérieure;Mars;3;2022;2022-03-01
France;1;0;Famille;Très bien;"Le lit inférieur n'avait pas de drap. Donc très compliqué pour dormir dedans.
Le fait de voir qu'une prise électrique avait pris feu auparavant n'est pas très rassurant quand nous devons branché une machine pour la nuit.";Accueil toujours aussi agréable. Un très très grand plaisir de revenir à chaque fois dans cet hôtel 😊;8.0;Chambre Supérieure - Côté Lac;Mars;3;2022;2022-03-01
France;1;0;Famille;Très bel hôtel;L'hôtel à beaucoup de qualité, toutefois le tarif est vraiment très élevé. C'est le prix à payer pour la proximité j'imagine, mais tout de même..;Le cadre, la proximité avec le parc, le thème. Le personnel est particulièrement agréable c'est un plaisir;8.0;Chambre Supérieure - Côté Lac;Mars;3;2022;2022-03-01
France;1;0;Couple;très bien;l’emplacement de la chambre;l’ambiance et le personnel;8.0;Chambre Supérieure;Mars;3;2022;2022-03-01
France;1;0;Couple;très bien;l’emplacement, le manqué d’équipement et aussi la décoration un peu vieille;le lit confortable , le calme , la restauration autour;8.0;Chambre Supérieure;Mars;3;2022;2022-03-01
France;1;0;Famille;Bien ;"Les poils ou cheveux trouvés sur la taie d'oreiller 
La salle de bain, en prenant un bain, vous voyez toutes les choses non nettoyés.
Un moment de détente qui se transforme en un moment je veux Vite sortir de la....";"La prestation de l'hôtel 
L'hôtel n'a pas des chambres abîmées avec des coups partout.
Le confort 
Le standing de cet hôtel
Le bar c'est super
La proximité avec le parc";7.0;Chambre Supérieure - Côté Lac;Mars;3;2022;2022-03-01
France;1;0;Famille;très bon séjour en famille.;pour trouver un côté négatif… cafetière dans la chambre mais pas de dosettes à dispo.;"la propreté et le confort de la chambre. 
la disponibilité de 2 lits parapluie pour nos jumeaux et la gentillesse du personnel. 
le passage de minnie le soir à l’hôtel était très appréciable.";8.0;Chambre Supérieure;Mars;3;2022;2022-03-01
France;1;0;Famille;Super, mon séjour aurait été excellent si ma chambre ne donnait pas sur la route,Bruit toute la nuit;La chambre donnait sur la route qui est très très empruntée, une horreur pour dormir, j'ai passé une très mauvaise nuit, je n'avais pas l'impression que le double vitrage soit d'actualité, la seule déception pour cet hotel;La piscine, la propreté de la chambre et de l'hôtel, le restaurant cape cod, la sympathie et le professionnalisme des agents, l'emplacement par rapport au parc;7.0;Chambre Supérieure;Mars;3;2022;2022-03-01
France;1;0;Famille;très bien;;proche parcs et rer;8.0;Chambre Supérieure;Mars;3;2022;2022-03-01
France;1;1;Famille;Bien;le tarif des petits déjeuners et repas … c’est vraiment abusé !;la proximité avec le parc;8.0;Chambre Supérieure;Février;2;2022;2022-02-01
Belgique;1;0;Couple;Sejour a refaire dans une autre aile de l hotel.;Vue de la chambre sur un parking de service et de poubelles. Petites odeurs nauseabondes jusqu a notre chambre. Balcon non nettoye.;proprete - amabilite du personnel - equipements dans l hotel;7.0;Chambre Supérieure;Février;2;2022;2022-02-01
France;1;0;Famille;Agréable;;Les lumieres cote parking qui reste allumé tt la nuit empechant de dormir car pas de volet dans les chambres;6.0;Chambre Supérieure;Février;2;2022;2022-02-01
France;2;0;Famille;C’était agréable;;Il manque des prises à côté du lit pour charger le téléphone.;7.0;Chambre Supérieure;Février;2;2022;2022-02-01
France;1;0;Famille;Très bien;"Le tarif des repas et surtout du petit déjeuner 😨
Manque de petits intentions comme petits cadeaux à offrir aux enfants à l'arrivée de l'hôtel...ou petits souvenirs mickey...";"Super hôtel, très beau cadre, chic, majestueux, belle chambre et belle vue..
Personnel accueillant, aimable et sécurisant pour controle sacs et pass sanitaire.
Piscine et déco magnifique.
Navette au top.";8.0;Chambre Supérieure;Février;2;2022;2022-02-01
