Names;Country;room_type;nuitee;reservation_date;traveler_infos;date_review;review_title;grade_review;positive_review;negative_review;usefulness_review;hotel;UniqueID
Ludovic;La Réunion;Chambre Supérieure - Côté Lac;2;Octobre 2022;Famille;Commentaire envoyé le 9 octobre 2022;Inoubliable;10;"Le petit déjeuner et l'excellent buffet pour le dîner du soir.
Choix et qualités des plats.";;0;Disney's Newport Bay Club;LudovicLa RéunionChambre Supérieure - Côté LacOctobre 2022FamilleCommentaire envoyé le 9 octobre 2022Inoubliable
Julien;France;Chambre Supérieure;1;Décembre 2022;Couple;Commentaire envoyé le 15 décembre 2022;Très bien;8,0;"Les navettes pour accéder au parc,
La taille de la chambre,
La personnalisation de la télé.";R.a.s;0;Disney's Newport Bay Club;JulienFranceChambre SupérieureDécembre 2022CoupleCommentaire envoyé le 15 décembre 2022Très bien
Celine;France;Chambre Supérieure;2;Décembre 2022;Famille;Commentaire envoyé le 14 décembre 2022;Agréable;6,0;Û;;0;Disney's Newport Bay Club;CelineFranceChambre SupérieureDécembre 2022FamilleCommentaire envoyé le 14 décembre 2022Agréable
Diego;France;Chambre Supérieure;1;Novembre 2022;Famille;Commentaire envoyé le 30 novembre 2022;Agréable;6,0;la proximité du parc Disneyland Paris;la qualité de la chambre n’était pas top, vieux équipements, rapport qualité prix n’est pas correct;0;Disney's Newport Bay Club;DiegoFranceChambre SupérieureNovembre 2022FamilleCommentaire envoyé le 30 novembre 2022Agréable
Fabienne;Belgique;Chambre Supérieure;1;Novembre 2022;Famille;Commentaire envoyé le 18 novembre 2022;déçue qualité prix;6,0;l emplacement;la propreté;0;Disney's Newport Bay Club;FabienneBelgiqueChambre SupérieureNovembre 2022FamilleCommentaire envoyé le 18 novembre 2022déçue qualité prix
Pierre;France;Chambre Supérieure;1;Novembre 2022;Famille;Commentaire envoyé le 14 novembre 2022;très moyen par rapport au prix;6,0;très bon personnel dédié mais la sécurité fait du zèle;hôtel très vieillissant et pas de shampoing gel douche;0;Disney's Newport Bay Club;PierreFranceChambre SupérieureNovembre 2022FamilleCommentaire envoyé le 14 novembre 2022très moyen par rapport au prix
Christine;France;Chambre Supérieure;1;Novembre 2022;Famille;Commentaire envoyé le 10 novembre 2022;Très bien;8,0;"La décoration de la chambre est adorable.
On a une bouilloire pour préparer du thé ou du café.
On a un large choix au petit déjeuné.
La piscine est top. Pas beaucoup de monde.
La boutique dans l hôtel est super pratique.";"La porte ne marchait pas bien.
Quand on met le badge. Il ne s ouvre pas du premier coup. On a du ré essayer pleins de fois.
La télé avait beaucoup d option en plus des chaînes normaux. Mais il fallait attendre longtemps pour passer d'un onglet a un autre.";0;Disney's Newport Bay Club;ChristineFranceChambre SupérieureNovembre 2022FamilleCommentaire envoyé le 10 novembre 2022Très bien
Gilles;France;Chambre Supérieure;1;Octobre 2022;Voyageur individuel;Commentaire envoyé le 1 novembre 2022;Comme une ambiance de croisière Disney;8,0;L'ambiance nautique de l'hôtel et la qualité des infrastructures rendent cette hôtel disney très agréable. Tout est mis en place pour que l'on se sentent bien après une belle journée au parc. Piscine & salle de sport ( serviettes fournis à discrétion ) , restaurant, bar et même une boutique Disney dans l'hôtel. Dans la chambre, machine à café senseo, thé et eau minéral.;Peut être le fait qu'on ne m'ait pas offert de badge en rapport avec la saison d'halloween :/ Mais sincèrement c'est vraiment pour trouver quelque chose !!;0;Disney's Newport Bay Club;GillesFranceChambre SupérieureOctobre 2022Voyageur individuelCommentaire envoyé le 1 novembre 2022Comme une ambiance de croisière Disney
Nino;Suisse;Chambre Supérieure;2;Octobre 2022;Famille;Commentaire envoyé le 19 octobre 2022;très bon moment passé en famille;7,0;je pense qu’il serait judicieux afin que l’on fasse un effort collectif concernant nos énergie d’éteindre les lumières à partir de minuit concernant la piscine extérieure et les guirlandes lumineuses;;0;Disney's Newport Bay Club;NinoSuisseChambre SupérieureOctobre 2022FamilleCommentaire envoyé le 19 octobre 2022très bon moment passé en famille
Anne-sophie;Suisse;Chambre Supérieure;2;Octobre 2022;Famille;Commentaire envoyé le 14 octobre 2022;agreable, très couteux;7,0;le personnel;"vieux (join, accessoires) et cher 
repas beaucoup trop cher pr les enfants";0;Disney's Newport Bay Club;Anne-sophieSuisseChambre SupérieureOctobre 2022FamilleCommentaire envoyé le 14 octobre 2022agreable, très couteux
Charline;Belgique;Chambre Supérieure;1;Septembre 2022;Famille;Commentaire envoyé le 10 octobre 2022;Avis mitigé;7,0;"L'hôtel est très joli, le décor est détaillé. 
Le lit double est confortable.
Le monsieur qui nous a accueillit à l'accueil était très sympa. Le petit déjeuner était très copieux, il y a beaucoup de choix différents pour les viennoiseries et les pains, chaque région peut se faire le petit-déjeuner qu'il aime.";"Lors de l'accueil, nous avons été accueilli par un monsieur très gentil, par contre une dame est venu l'interrompre plusieurs fois parce qu'elle avait fini sa journée et qu'il devait faire quelque chose avec elle... elle n'était pas souriante et a bien fait comprendre que nous étions dérangeant.
Nous avions demandé un lit bébé dans la chambre, il y en avait un mais c'est un lit de voyage sans matelas supplémentaire, un lit vraiment pas confortable. Et dans la seconde chambre il y avait un lit très confortable et l'autre pas du tout, matelas très usé. 
Dans une des chambres il y avait des mies de pain sur le sol et des mouchoirs par terre. 
Il manque un frigo dans les chambres car par exemple nous avions du lait pour notre enfant à conserver au frais après ouverture... nous avons pu le jeter alors que le matin notre enfant devait boire du lait.
Je trouve dommage d'avoir des détails comme ceux là négatif alors que c'est actuellement le 2 ème meilleur hôtel de ma chaîne Disneyland Paris";2;Disney's Newport Bay Club;CharlineBelgiqueChambre SupérieureSeptembre 2022FamilleCommentaire envoyé le 10 octobre 2022Avis mitigé
Andre;France;Chambre Supérieure - Côté Lac;1;Septembre 2022;Famille;Commentaire envoyé le 1 octobre 2022;cher pour les prestations fournis;6,0;pas loin du parc Disney;pas conforme à ma réservation et pas à la hauteur d un 4 étoiles;2;Disney's Newport Bay Club;AndreFranceChambre Supérieure - Côté LacSeptembre 2022FamilleCommentaire envoyé le 1 octobre 2022cher pour les prestations fournis
Christophe;France;Chambre Supérieure;1;Septembre 2022;Famille;Commentaire envoyé le 29 septembre 2022;Cher et bof !;6,0;C'était l'usine ! L'hôtel etait noir de monde, la queue à la réception, des groupes bruyants, des couloirs interminables, signalisation insuffisante des ascenseurs, manque de souplesse du personnel appliquant des procédures rigides ...;;1;Disney's Newport Bay Club;ChristopheFranceChambre SupérieureSeptembre 2022FamilleCommentaire envoyé le 29 septembre 2022Cher et bof !
Severine;Belgique;Chambre Supérieure;1;Septembre 2022;Famille;Commentaire envoyé le 25 septembre 2022;déçu de bcp de chose;6,0;personnel super gentil bien placer par rapport au parc Disney;"chambre déplorable, matelas TRÈS USÉS ( très mal au dos au réveil) sanitaire à refaire complètement 
propreté correcte mais peux mieux faire au vu du prix de la nuitée 530€ sans petit déjeuner pour 4";1;Disney's Newport Bay Club;SeverineBelgiqueChambre SupérieureSeptembre 2022FamilleCommentaire envoyé le 25 septembre 2022déçu de bcp de chose
Francois;Belgique;Chambre Supérieure;1;Septembre 2022;Famille;Commentaire envoyé le 21 septembre 2022;Très bien;8,0;la situation et les décors le confort;manque d’équipements pour le prix . pas de frigo ds la chambre une cafetière sans café . là contrôleur de la Clim qui ne marche pas très bien;0;Disney's Newport Bay Club;FrancoisBelgiqueChambre SupérieureSeptembre 2022FamilleCommentaire envoyé le 21 septembre 2022Très bien
Sylvie;France;Chambre Supérieure - Côté Lac;2;Août 2022;Voyageur individuel;Commentaire envoyé le 31 août 2022;Avis mitigé;7,0;Hôtel : magnifique. Très belle décoration. Parties communes et restaurants très agréables;La chambre : absolument pas la hauteur du prix. Absence de produits de toilettes, de nécessaire à cafe-the-tisane. Les chaînes Disney de la TV étaient indisponibles. Linge de toilette vieillissant. Besoin général d'un rafraichissement. Ne correspond pas à une chambre d'hôtel 4****;1;Disney's Newport Bay Club;SylvieFranceChambre Supérieure - Côté LacAoût 2022Voyageur individuelCommentaire envoyé le 31 août 2022Avis mitigé
Fatima;Belgique;Chambre Supérieure;2;Juillet 2022;Famille;Commentaire envoyé le 15 août 2022;Agréable;7,0;La chambre et le déjeuner;;0;Disney's Newport Bay Club;FatimaBelgiqueChambre SupérieureJuillet 2022FamilleCommentaire envoyé le 15 août 2022Agréable
Jack;Belgique;Chambre Supérieure;1;Août 2022;Famille;Commentaire envoyé le 7 août 2022;Prix élevé mais totalement justifié;7,0;Déjeuner de qualité, service rapide, personnel sympa et disponible.;Pas de frigo dans la chambre dommage.;0;Disney's Newport Bay Club;JackBelgiqueChambre SupérieureAoût 2022FamilleCommentaire envoyé le 7 août 2022Prix élevé mais totalement justifié
Maëva;France;Chambre Supérieure - Côté Lac;1;Août 2022;Famille;Commentaire envoyé le 4 août 2022;excellent;8,0;la déco, la piscine;rien;0;Disney's Newport Bay Club;MaëvaFranceChambre Supérieure - Côté LacAoût 2022FamilleCommentaire envoyé le 4 août 2022excellent
Rosetta;France;Chambre Supérieure - Côté Lac;1;Juin 2022;Famille;Commentaire envoyé le 15 juillet 2022;agréable mais manque d animation;8,0;le décor la propreté;pas de personnages Disney;0;Disney's Newport Bay Club;RosettaFranceChambre Supérieure - Côté LacJuin 2022FamilleCommentaire envoyé le 15 juillet 2022agréable mais manque d animation
Jean;France;Chambre Supérieure;2;Juillet 2022;Famille;Commentaire envoyé le 8 juillet 2022;très cher sans raison;6,0;pas grand chose, c’est vétuste , les salles de bains sont pitoyables ,le mobilier est dans un état pitoyable . bref pour le prix peu mieux faire …;états du mobiliers dans les chambres , le service;0;Disney's Newport Bay Club;JeanFranceChambre SupérieureJuillet 2022FamilleCommentaire envoyé le 8 juillet 2022très cher sans raison
Lionel;France;Chambre Supérieure;1;Juillet 2022;Famille;Commentaire envoyé le 8 juillet 2022;Bien mais trop cher;7,0;La localisation;Le petit déjeuner est vraiment hors de prix;0;Disney's Newport Bay Club;LionelFranceChambre SupérieureJuillet 2022FamilleCommentaire envoyé le 8 juillet 2022Bien mais trop cher
Brahim;France;Chambre Supérieure - Côté Lac;2;Juin 2022;Famille;Commentaire envoyé le 26 juin 2022;Très bien;8,0;Belle hôtel bon emplacement;Les Lits devraient être plus large;0;Disney's Newport Bay Club;BrahimFranceChambre Supérieure - Côté LacJuin 2022FamilleCommentaire envoyé le 26 juin 2022Très bien
Brice;France;Chambre Supérieure avec Terrasse;1;Juin 2022;Famille;Commentaire envoyé le 17 juin 2022;je ne passerais plus par booking pour mes vacances;7,0;Disneyland;nous avons louer une chambre supérieur avec terrasse je cherche toujours la terrasse … ne louer pas de chambre avec terrasse quand celle ci est inexistante;0;Disney's Newport Bay Club;BriceFranceChambre Supérieure avec TerrasseJuin 2022FamilleCommentaire envoyé le 17 juin 2022je ne passerais plus par booking pour mes vacances
Jessica;La Réunion;Chambre Supérieure;1;Juin 2022;Famille;Commentaire envoyé le 15 juin 2022;Super malgré quelques points à améliorer;8,0;Le personnel est extrêmement agréable, tout est fait pour que nous ayons un accueil chaleureux;Plateau de courtoisie des anciens occupants non débarrassé, pas de dosette pour la cafetière, salle de bain vieillissante (distributeur de savon et porte serviettes cassés);0;Disney's Newport Bay Club;JessicaLa RéunionChambre SupérieureJuin 2022FamilleCommentaire envoyé le 15 juin 2022Super malgré quelques points à améliorer
Emilie;Suisse;Chambre Supérieure - Côté Lac;4;Mai 2022;Famille;Commentaire envoyé le 14 juin 2022;Agréable;6,0;La proximité avec le parc, les grandes piscines intérieures et extérieures assez chauffée pour les enfants, la gentillesse du personnel du bar.;"Le lit bébé pour notre fille de 2ans ! 
Cet hôtel doit accueillir une multitude d'enfants et pourtant le lit se résumait à un voeux lit parapluie avec un drap blanc trop grand. 
Pas de drap Disney sympa, pas de petit kit d'arrivée, de petit savon ou produit de soin pour les enfants. C'est limite pour un 4*.
Le service minimum dans la chambre. 
Il fallait toujours réclamer pour avoir du papier toilette, de l'eau ou même des cotons-tiges. Tout est disponible gratuitement mais rien n'est mis dans la chambre.";2;Disney's Newport Bay Club;EmilieSuisseChambre Supérieure - Côté LacMai 2022FamilleCommentaire envoyé le 14 juin 2022Agréable
Valène;France;Chambre Supérieure - Côté Lac;1;Juin 2022;Famille;Commentaire envoyé le 11 juin 2022;Très bien;8,0;le décor, le personnel et la proximité avec le parc;Pour le prix déçue de ne pas voir les personnages dans l’hôtel. la TV ne fonctionnait pas le 1er jour et pas de capsule à café à côté de la machine à café.;0;Disney's Newport Bay Club;ValèneFranceChambre Supérieure - Côté LacJuin 2022FamilleCommentaire envoyé le 11 juin 2022Très bien
Anaïs;France;Chambre Supérieure - Côté Lac;1;Mai 2022;Famille;Commentaire envoyé le 2 juin 2022;Super !;8,0;"Chambre très spacieuse, propre
Superbe vue sur le lac";"Pas de café/thé à disposition dans les chambres 
Manque de serviettes et de prises électriques";0;Disney's Newport Bay Club;AnaïsFranceChambre Supérieure - Côté LacMai 2022FamilleCommentaire envoyé le 2 juin 2022Super !
Etienne;Suisse;Chambre Supérieure avec Terrasse;2;Mai 2022;Famille;Commentaire envoyé le 28 mai 2022;Nous avons passé un très bon séjour dans l’ensemble!;8,0;"• le buffet Cape-Cod, petit-déjeuner et dîner est de bonne qualité, heureusement au prix, certes, mais même les plats de poissons et fruits de mer sont savoureux , rare dans une telle industrie!
• les cast members (employés) se donnent énormément de peine pour être avenants et sympathiques (même sur une journée rouge et noire en fréquentation) 
• les chambres sont confortables et fonctionnelles 
• les flux et infrastructures sont bien pensés";"rien de trop significatif à signaler ;
• rapport qualité-prix on ne reviendra pas dessus c’est Disney c’est ainsi et on est post-covid soit
• mal reçu au desk Concierge pour une demande, pas gravissime, je m’attendais pas à des miracles clé d’or , je voulais juste me renseigner s’il y avait une chance de déplacer une réservation buffet soir de 45 minutes en anticipant , la réponse du monsieur:
« c’est ça ou McDo estimez vous heureux de pouvoir dîner avec vos enfants » j’aurais préféré un « désolé rien n’est possible pour ce soir » pour un 4* à ce tarif…";3;Disney's Newport Bay Club;EtienneSuisseChambre Supérieure avec TerrasseMai 2022FamilleCommentaire envoyé le 28 mai 2022Nous avons passé un très bon séjour dans l’ensemble!
Emilie-julien;France;Chambre Supérieure;1;Mai 2022;Famille;Commentaire envoyé le 21 mai 2022;Un très bel hôtel, un très beau séjour malgré quelques petits problèmes au démarrage.;8,0;L'hôtel, sa situation, sa décoration, les équipements qu'il propose correspondent véritablement à nos attentes lors de la réservation. Cela a été une parenthèse magique, enchantée pour notre famille.;"Nous n'avons pas eu de chambres adjacentes alors que nous l'avons demandé. Après l'enregistrement, le personnel nous a indiqué qu'un sms nous serait envoyé pour nous prévenir que les chambres étaient prêtes, mais nous ne l'avons jamais reçu. Il y a enfin eu un problème au moment de l'enregistrement des cartes pour accéder aux chambres ; nous nous sommes rendus compte qu'elles n'étaient pas activées, devant la porte de la chambre [...]. Dommage. Malgré ces désagréments dont on pourrait ce passer compte tenu du prix de l'hôtel, le séjour s'est très bien passé.";1;Disney's Newport Bay Club;Emilie-julienFranceChambre SupérieureMai 2022FamilleCommentaire envoyé le 21 mai 2022Un très bel hôtel, un très beau séjour malgré quelques petits problèmes au démarrage.
Emmanuel;France;Chambre Supérieure - Côté Lac;2;Mai 2022;Famille;Commentaire envoyé le 16 mai 2022;Bien ;7,0;la qualité de la restauration;;0;Disney's Newport Bay Club;EmmanuelFranceChambre Supérieure - Côté LacMai 2022FamilleCommentaire envoyé le 16 mai 2022Bien 
Romain;France;Chambre Supérieure;1;Mai 2022;Famille;Commentaire envoyé le 7 mai 2022;Agréable;6,0;Disney accueil parfait;"La chambre : 
Lit 140 matela qui a vecu
Robineterie non vice qui tourne sur elle meme
Chambre besoin d un coup de jeune
Pour 350 euro la nuit ......";1;Disney's Newport Bay Club;RomainFranceChambre SupérieureMai 2022FamilleCommentaire envoyé le 7 mai 2022Agréable
Calot;France;Chambre Supérieure;1;Avril 2022;Famille;Commentaire envoyé le 2 mai 2022;ULTRA CHER !!!!!!!!!!!!!!!!!!!!!!!!!!!!!!!!!!!!!!!;7,0;Nous allons à l'hotel à coté du Parc Disney donc avec des enfants. Le menu Enfant 30€ et le petit déjeuné 23€ pour un enfant de 4 ans est tout simplement aberrant!!!!!!!!!!! et même pour un enfant de 9 ans.;;0;Disney's Newport Bay Club;CalotFranceChambre SupérieureAvril 2022FamilleCommentaire envoyé le 2 mai 2022ULTRA CHER !!!!!!!!!!!!!!!!!!!!!!!!!!!!!!!!!!!!!!!
Arnaud;France;Chambre Supérieure;1;Mars 2022;Famille;Commentaire envoyé le 29 avril 2022;.SOS doudous laisse un goût amer...;7,0;La chambre est spacieuse et bien équipée. L'hôtel est grandiose est super bien place à côté du parc;Nous avons oublié les doudous dans la chambre. Nous avons appelé l'hôtel immédiatement après l'avoir quitté pour les prévenir mais rien a été fait... Il est désolant que dans un hôtel à ce prix, qui reçoit des milliers d'enfants chaque jour, dans un parc qui émerveille les enfants, aucun service doudous perdus soit mis en place et que les doudous ne soient pas mieux considérés que cela...;1;Disney's Newport Bay Club;ArnaudFranceChambre SupérieureMars 2022FamilleCommentaire envoyé le 29 avril 2022.SOS doudous laisse un goût amer...
Laurence;France;Chambre Supérieure;1;Avril 2022;Famille;Commentaire envoyé le 28 avril 2022;Site de l'hôtel idéal, qualité équipements et chambres moyenne;6,0;Le personnel a l'écoute . La propreté et le calme.;Chambre familiale exiguë. Salle de bains vétuste. Rapport qualité- prix pas adapté du tout.;0;Disney's Newport Bay Club;LaurenceFranceChambre SupérieureAvril 2022FamilleCommentaire envoyé le 28 avril 2022Site de l'hôtel idéal, qualité équipements et chambres moyenne
Sylvie;France;Chambre Supérieure;1;Mars 2022;Famille;Commentaire envoyé le 24 avril 2022;Très bon séjour, dommage que le beau temps n'y était pas.;8,0;Super petit déjeuner et le personnel trop gentil ! Par contre notre chambre était un peu vieillotte, je m'attendais à mieux.;La déco faisait vieillotte, télé que nous l'avions connue il y a quelques années.;0;Disney's Newport Bay Club;SylvieFranceChambre SupérieureMars 2022FamilleCommentaire envoyé le 24 avril 2022Très bon séjour, dommage que le beau temps n'y était pas.
Gilles;France;Chambre Supérieure;1;Mars 2022;Famille;Commentaire envoyé le 19 avril 2022;Très bel hôtel, bien situé à l'entrée du parc. Mais absolument pas confortable, literie : une cata;6,0;"La situation de l'hôtel est top, juste à côté du parc. On est directement plongés dans l'ambiance Disney.. 
Le restaurant est excellent, heureusement car très très cher...";"Literie absolument pas au niveau pour le prix demandé... le matelas : une vraie planche, on se réveille avec un mal de dos pas possible. Les oreillers mous.. salle de bain vieillotte.
Pour le prix payé ce n'est absolument pas normal de dormir aussi mal...";0;Disney's Newport Bay Club;GillesFranceChambre SupérieureMars 2022FamilleCommentaire envoyé le 19 avril 2022Très bel hôtel, bien situé à l'entrée du parc. Mais absolument pas confortable, literie : une cata
Dominique;France;Chambre Supérieure - Côté Lac;4;Mars 2022;Famille;Commentaire envoyé le 13 avril 2022;Très correct prix en rapport avec les prestations;8,0;Cadre situation Pdj en chambre;Un p’tit coin repas plus pratique;0;Disney's Newport Bay Club;DominiqueFranceChambre Supérieure - Côté LacMars 2022FamilleCommentaire envoyé le 13 avril 2022Très correct prix en rapport avec les prestations
Coralie;France;Chambre Supérieure;1;Mars 2022;Famille;Commentaire envoyé le 12 avril 2022;Bien ;7,0;L emplacement par rapport au parc;L'impossibilité pour mon fils de prendre une photo avec le personnage car il était trop tard .....;1;Disney's Newport Bay Club;CoralieFranceChambre SupérieureMars 2022FamilleCommentaire envoyé le 12 avril 2022Bien 
Corinne;Israël;Chambre Supérieure;2;Avril 2022;Famille;Commentaire envoyé le 11 avril 2022;Très bien;8,0;"La cjambre etait grande. Le personnel tres accueillant. La chambre propre.
Le lac magnifique et la proximité a disney extra.";"La chambre est trop loin de l ascenseur. 323 pas pour y accéder 
Il n y a pas de café et de restaurant a part le petit dejeuner.
L acclim ne marche pas trop bien.";0;Disney's Newport Bay Club;CorinneIsraëlChambre SupérieureAvril 2022FamilleCommentaire envoyé le 11 avril 2022Très bien
Franck;France;Chambre Supérieure;1;Avril 2022;Famille;Commentaire envoyé le 9 avril 2022;Très bien;8,0;"Le décor 
La réaction pour nous changer de chambre (10min)";"Je pense qu’il mette au second plan les réservations Booking.com 
Heureusement après un appel à la réception on nous a changer de chambre";0;Disney's Newport Bay Club;FranckFranceChambre SupérieureAvril 2022FamilleCommentaire envoyé le 9 avril 2022Très bien
Anne-sophie;Belgique;Chambre Supérieure;2;Avril 2022;Voyageur individuel;Commentaire envoyé le 9 avril 2022;Bien ;7,0;le confort, l’amabilité, le fait qu’on puisse voir des personnages de Disney;le fait qu’on débarrasse la table du déjeuner alors que je n’avais pas fini, 28€ pour un buffet à volonté et qu’on débarrasse la table ça fait cher payé.;1;Disney's Newport Bay Club;Anne-sophieBelgiqueChambre SupérieureAvril 2022Voyageur individuelCommentaire envoyé le 9 avril 2022Bien 
Jennifer;France;Chambre Supérieure;1;Avril 2022;Groupe;Commentaire envoyé le 8 avril 2022;passable;7,0;la propreté des lieux;nous devions avoir une baignoire et deux lits doubles. Et nous avons eu un lit double et un lit superposé ainsi qu’une douche… quelle déception;1;Disney's Newport Bay Club;JenniferFranceChambre SupérieureAvril 2022GroupeCommentaire envoyé le 8 avril 2022passable
Marie;France;Chambre Supérieure;2;Avril 2022;Famille;Commentaire envoyé le 2 avril 2022;Très bien;8,0;La chambre, la rencontré avec Mickey;Le prix du buffet;0;Disney's Newport Bay Club;MarieFranceChambre SupérieureAvril 2022FamilleCommentaire envoyé le 2 avril 2022Très bien
Nor;France;Chambre Supérieure;1;Mars 2022;Famille;Commentaire envoyé le 1 avril 2022;Très bien;8,0;la douche c une catastrophe;;0;Disney's Newport Bay Club;NorFranceChambre SupérieureMars 2022FamilleCommentaire envoyé le 1 avril 2022Très bien
Keitoun;France;Chambre Club Compass (2 Adultes);1;Mars 2022;Famille;Commentaire envoyé le 30 mars 2022;Très bon séjour, à renouveler;8,0;La situation, le compass club car on est chouchoute;Un seul peignoir pour 2 personnes, l'absence de gel douche dans la salle de bain;0;Disney's Newport Bay Club;KeitounFranceChambre Club Compass (2 Adultes)Mars 2022FamilleCommentaire envoyé le 30 mars 2022Très bon séjour, à renouveler
Marie;France;Chambre Supérieure;1;Mars 2022;Groupe;Commentaire envoyé le 30 mars 2022;tres bon séjour;6,0;La proximité du parc, le décor et thème de l’hôtel. personnel agréable;chambre très loin de l’entrée, j’ai du traverser des couloirs infinis pour y accéder avec ma fibromyalgie c’est très compliqué de marcher autant avec les douleurs chroniques;0;Disney's Newport Bay Club;MarieFranceChambre SupérieureMars 2022GroupeCommentaire envoyé le 30 mars 2022tres bon séjour
Lidia;France;Chambre Supérieure;1;Mars 2022;Famille;Commentaire envoyé le 30 mars 2022;Hotel classe personnel souriant chambre agréable et lit confortable;8,0;"Tout proche du parc Disney
Bel hôtel bien classe";"La machine à café complètement à l opposé de la chambre 
La lumière et le bruit à côté du sauna hamam";0;Disney's Newport Bay Club;LidiaFranceChambre SupérieureMars 2022FamilleCommentaire envoyé le 30 mars 2022Hotel classe personnel souriant chambre agréable et lit confortable
Aurélie;Belgique;Chambre Supérieure;1;Mars 2022;Famille;Commentaire envoyé le 29 mars 2022;sympa;7,0;le côté féerique les détails de disney;"- longue attente au check in le soir 
- lit double 1m40
- le prix du petit déjeuner 
- la chambre tout au bout de l’hôtel 
- pas de brosse pour les toilettes";0;Disney's Newport Bay Club;AurélieBelgiqueChambre SupérieureMars 2022FamilleCommentaire envoyé le 29 mars 2022sympa
Kahina;France;Chambre Supérieure;1;Mars 2022;Famille;Commentaire envoyé le 28 mars 2022;Magnifique;8,0;Les réceptionnistes étaient top et tout les autres personnels de l’hôtel était top. :-);Certains défauts dans la salle de bain;0;Disney's Newport Bay Club;KahinaFranceChambre SupérieureMars 2022FamilleCommentaire envoyé le 28 mars 2022Magnifique
